"Title","Slug","IsPublished","SortOrder","PrimaryCategory","Sku","Brand","Categories","ShortDescription","BodyMd","DetailsMd","BenefitsMd","MaterialsMd","FinishesMd","TechnicalSpecsMd","ApplicationsMd","FaqsJson","PublishedAt","ImageSrc","ImageWidth","ImageHeight","ImageAlt","GalleryImagesJson","Price","ReviewCount","PriceCurrency","InStock","RatingValue","MetaTitle","FormFieldsJson","FormatsMd","MetaDescription","Canonical","HrefLangJson","KeywordsJson","SchemaJson","SearchTermsJson","AttributesJson","Gtin13","Mpn","VariantsJson","LegacySlugsJson","RobotsOverride","RobotsAdvanced","OgImageSrc","Path","NoIndex"
"Textil reposacabezas personalizado","textil-reposacabezas-personalizado","Verdadero",,"eventos","01-EVEN-0015","Reprodisseny",,"El textil reposacabezas es una solución práctica para ganar visibilidad en espacios con público: asientos, gradas, zonas VIP o traslados de evento. Personalizamos fundas/reposacabezas textiles con tu logo, patrocinadores o mensajes, cuidando el ajuste y la durabilidad para que quede limpio, cómodo y profesional.","##Detalles
¿Qué es un textil reposacabezas y para qué se usa?
Un textil reposacabezas es una funda o pieza de tela diseñada para colocarse en la parte superior del asiento (zona de la cabeza). Se utiliza como soporte de branding y comunicación en entornos donde hay muchas sillas o asientos alineados, porque multiplica la exposición del mensaje con un formato discreto, útil y fácil de instalar.
##Beneficios
•	Alta visibilidad por repetición: ideal cuando hay filas de asientos (cada asiento suma impacto).
•	Branding sin ocupar espacio: no interfiere con la zona de paso ni con la experiencia del asistente.
•	Instalación y retirada rápida: pensado para montajes de evento y campañas temporales.
•	Personalización completa: logo, patrocinadores, claims, códigos o mensajes por zona/rol.
•	Coherencia de evento: refuerza la identidad visual junto a acreditaciones, señalética y photocall.
##Aplicaciones
•	Eventos corporativos y congresos: auditorios, ponencias, zonas VIP, salas plenarias.
•	Ferias y presentaciones: áreas de charla, conferencias y espacios de marca.
•	Eventos deportivos y culturales: gradas, espacios reservados o zonas de patrocinio.
•	Transporte de evento: shuttles, autocares o servicios de traslado (marca y patrocinadores).
•	Acciones de patrocinio: visibilidad por sectores (patrocinador principal, colaboradores, media partners).
##Características técnicas
Formato y medidas
•	Medidas estándar o a medida según el tipo de asiento (silla, butaca, grada, etc.).
•	Diseño con márgenes y zonas seguras para que el texto/logos queden centrados y legibles.
Tejidos y uso
•	Tejidos pensados para impresión textil y uso en evento (según duración y manipulación).
•	Opciones orientadas a campañas cortas o a usos más recurrentes (reutilización), según necesidades.
Sistemas de fijación
•	Diferentes opciones para que el reposacabezas quede bien sujeto (por ejemplo, tipo funda/bolsillo, elástico, velcro u otras soluciones según asiento).
•	Se define en función del modelo de asiento y el tiempo de instalación disponible.
Impresión y personalización
•	Impresión a color con buena reproducción para que el branding se vea nítido a distancia corta/media.
•	Posibilidad de incluir QR (agenda, mapa, registro, encuesta, landing de patrocinador).
•	Variantes por zonas: diferentes diseños por sector, día o patrocinador.
Acabados y confección
•	Remates y costuras pensados para resistir manipulación durante el evento.
•	Empaquetado por sets o por zonas para facilitar el montaje (si lo necesitas).
",,,,,,,"Preguntas frecuentes
[{""question"":""¿Se puede adaptar a cualquier tipo de asiento?”
“answer”:”Sí. Lo habitual es definir medida y sistema de fijación según la silla/butaca. Si nos indicas el modelo o nos pasas una foto, lo planteamos a medida.""}
{""question"":""¿Se pueden hacer varias versiones (VIP, staff, patrocinadores)?”
“answer”:”Sí. Podemos producir diseños por zonas/roles o por patrocinador manteniendo coherencia de marca.""}
{""question"":""¿Aguanta un evento de varios días?”
“answer”:”Depende del tejido y del uso (montaje/desmontaje, manipulación, etc.). Te recomendamos la opción más adecuada según duración y condiciones.""}
{""question"":""¿Podéis preparar el pack listo para montar?”
“answer”:”Sí, podemos organizarlo por cajas/paquetes etiquetados (por zona, fila o sector) para agilizar el montaje.""}]
",,"https://webcms.blob.core.windows.net/media/product/eventos/textil-reposacabezas.webp","1.200","1.200","alt descripció de la foto","[]","$0,00","0","EUR","Verdadero","0","Textil Reposacabezas Personalizado | Publicidad y Branding para Eventos","[{""label"":""Tamaño"",""name"":""tamaño"",""type"":""select"",""required"":true},{""label"":""Impresión"",""name"":""impresión"",""type"":""select"",""required"":true,""options"":[""Cuatricromía 1 cara""]},{""label"":""Material"",""name"":""material"",""type"":""select"",""required"":true},{""label"":""Cantidad"",""name"":""cantidad"",""type"":""number"",""required"":true},{""label"":""Observaciones"",""name"":""observaciones"",""type"":""text"",""required"":false}]",,"Textil reposacabezas personalizado para asientos, zonas VIP y transporte de eventos. Impresión a color, medidas a medida y opciones de fijación. Pide presupuesto.","https://reprodisseny.com/productos/textil-cabezas","[{""lang"":""es-ES"",""url"":""https://reprodisseny.com/productos/textil-cabezas""},{""lang"":""ca-ES"",""url"":""https://reprodisseny.com/productos/textil-cabezas""}]","[""textil reposacabezas""]","{}","[""textil reposacabezas""]","[]",,,"[]",,,,,,"Verdadero"
"Tiras de lineal personalizadas","tiras-de-lineal-personalizadas","Verdadero",,"material-publicitario","01-OFICI-0014","Reprodisseny",,"Las tiras de lineal (o cenefas de estantería) son una pieza de PLV imprescindible para ordenar el lineal y mejorar la visibilidad de una promoción o categoría. En Repro Disseny fabricamos tiras personalizadas a medida para estanterías, con impresión nítida y opciones de material y fijación para que queden bien colocadas y aguanten el uso en tienda.","##Detalles 

¿Qué es una tira de lineal y para qué se usa? 

Una tira de lineal es una banda gráfica que se coloca en el frontal del estante (en el borde o rail portaprecios) para comunicar de forma continua: promociones, familias de producto, mensajes de marca, novedades o señalización de secciones. 
A diferencia de un stopper o una banderola, la tira acompaña el recorrido del cliente por el lineal, reforzando la lectura y la orientación. 

##Beneficios 

Ordena y guía en el lineal: facilita encontrar categorías y productos. 

Refuerza promociones: ideal para campañas (“-20%”, “2x1”, “nuevo”, “recomendado”). 

Aumenta visibilidad sin ocupar espacio: se integra en el frontal del estante. 

Cohesiona la campaña: mismo mensaje repetido en varios metros de lineal. 

Fácil de instalar y renovar: perfecta para rotación por temporadas o promociones. 

##Aplicaciones 

Supermercados y retail: campañas estacionales, rebajas, lanzamientos y categorías. 

Farmacia/parafarmacia: campañas por laboratorio, recomendados, novedades. 

Tiendas especializadas: señalización por familias y ofertas destacadas. 

Showrooms: identificación de gamas o secciones en exposición. 

Corners temporales: promociones por tiempo limitado con cambio rápido. 

##Características técnicas 

Medidas y formato 

Tiras en medidas estándar o a medida según estantería/rail. 

Posibilidad de fabricar por tramos para cubrir distintos módulos del lineal. 

Materiales 

Soportes flexibles o semirrígidos según sistema de instalación y duración de campaña. 

Opciones más resistentes si habrá limpieza frecuente o manipulación. 

Impresión 

Impresión a todo color con buena legibilidad (titular grande + beneficio claro). 

Series por campaña, categoría o tienda manteniendo coherencia visual. 

Fijación e instalación 

Preparadas para rail portaprecios, inserción, adhesivo o sistema de la tienda (según modelo). 

Si nos indicas el tipo de estantería o nos envías una foto del rail, lo adaptamos para que encaje perfecto. 

Acabados opcionales 

Laminado si necesitas más resistencia al roce o a la limpieza. 

Corte recto y acabado limpio para montaje rápido. ",,,,,,,"Preguntas frecuentes 

[{""question"":""¿En qué se diferencia de un stopper o una banderola de lineal?” 
“answer”:”La tira va en el frontal y acompaña todo el estante; el stopper sobresale hacia el pasillo; la banderola actúa como señal vertical o “bandera” para destacar desde lejos.""}, 

{""question"":""¿Se pueden hacer por módulos y campañas?” 
“answer”:”Sí, es lo habitual: sets por promoción/temporada y por medidas de cada mueble.""}, 

{""question"":""¿Conviene laminado?” 
“answer”:”Si la campaña dura semanas o hay limpieza/manipulación, el laminado ayuda a mantenerla en buen estado.""}, 

{""question"":""¿Podéis adaptar el diseño al rail?” 
“answer”:”Sí: ajustamos altura, márgenes y zona útil para que quede legible y no se “pierda” en el sistema de sujeción.""}]",,"https://webcms.blob.core.windows.net/media/product/publicidad-oficina/publicidad/tira-lineal.webp","1.200","1.200","alt descripció de la foto","[]","$0,00","0","EUR","Verdadero","0","Tiras de lineal personalizadas | PLV para estanterías y punto de venta","[{""label"":""Tamaño"",""name"":""tamaño"",""type"":""select"",""required"":true,""options"":[""60 x 4 cm""]},{""label"":""Impresión"",""name"":""impresión"",""type"":""select"",""required"":true,""options"":[""Cuatricromía 1 cara""]},{""label"":""Papel"",""name"":""papel"",""type"":""select"",""required"":true,""options"":[""Estucado mate 250 gr.""]},{""label"":""Acabado"",""name"":""acabado"",""type"":""select"",""required"":true,""options"":[""Sin plastificar"",""Plastificado mate""]},{""label"":""Cantidad"",""name"":""cantidad"",""type"":""number"",""required"":true},{""label"":""Observaciones"",""name"":""observaciones"",""type"":""text"",""required"":false}]",,"Tiras de lineal personalizadas para destacar categorías y promociones en estantería. Impresión a color, medidas a medida y fijación para rail/adhesivo. Solicita presupuesto.","https://reprodisseny.com/productos/tiras-lineal","[{""lang"":""es-ES"",""url"":""https://reprodisseny.com/productos/tiras-lineal""},{""lang"":""ca-ES"",""url"":""https://reprodisseny.com/productos/tiras-lineal""}]","[""tiras lineal""]","{}","[""tiras lineal""]","[]",,,"[]",,,,,,"Verdadero"
"Tótems publicitarios personalizados (expositores de suelo)","totems-publicitarios-personalizados","Verdadero",,"expositores","01-EXPO-0003","Reprodisseny",,"Los tótems son expositores de suelo pensados para comunicar con impacto en espacios de paso: entradas, pasillos, stands, tiendas o recepciones. En Repro Disseny producimos tótems personalizados en distintos materiales rígidos, con opciones a una o dos caras, corte a medida y soluciones de base para que queden estables y con una imagen profesional.","##Detalles 

¿Qué es un tótem y para qué se usa? 

Un tótem publicitario es una pieza vertical autoportante (o con base) que se coloca en el suelo para mostrar información de forma visible: promociones, señalización, lanzamientos, direcciones, marcas o mensajes corporativos. Se utiliza cuando necesitas más presencia que un cartel, pero manteniendo una instalación sencilla y sin obras. 

##Beneficios 

Alta visibilidad a distancia: formato vertical ideal para captar atención en zonas de paso. 

Estabilidad y presencia: solución “de suelo” con opciones de base para evitar vuelcos. 

Personalización total: medidas, diseño, forma, una o dos caras, mensajes por zonas. 

Versátil para campañas: útil para promociones temporales o señalización recurrente. 

Imagen profesional: mejora la experiencia del visitante y refuerza la marca en puntos clave. 

##Aplicaciones 

Ferias y congresos: entradas, registro, señalización de salas, stands y recorridos. 

Punto de venta y retail: promociones, lanzamientos, precios, campañas estacionales. 

Empresas y oficinas: recepciones, indicaciones, comunicación interna, eventos corporativos. 

Hostelería y hoteles: eventos, menús, señalización de espacios, horarios. 

Centros y entidades: orientación al público, campañas institucionales, información de acceso. 

##Características técnicas 

Formatos y medidas 

Tótems en tamaños estándar o a medida, según espacio y distancia de lectura. 

Posibilidad de diseño estrecho y alto para pasillos, o más ancho si necesitas más información. 

Materiales habituales 

Cartón pluma/foam: ligero y muy práctico para interior y campañas temporales. 

PVC/Forex u otros rígidos: más resistente, recomendable para uso más intensivo o reutilización. 

Nido de abeja: ideal para grandes formatos con buena rigidez y poco peso (muy útil si se mueve). 

Una cara o doble cara 

Una cara si va apoyado a pared o en un punto fijo orientado. 

Doble cara si estará en zonas de paso donde se ve desde ambos sentidos. 

Corte y personalización 

Recto (formato clásico) o corte a medida para siluetas, coronas superiores, flechas, etc. 

Posibilidad de integrar QR para ampliar información (mapa, agenda, registro, catálogo). 

Bases y estabilidad 

Opciones de peana/base según tamaño y ubicación. 

Soluciones pensadas para que el tótem quede firme sin complicar el montaje. 

Acabados recomendados 

Mate si habrá focos o se fotografiará (reduce reflejos). 

Laminado/protección si se va a manipular mucho o a mover de ubicación. ",,,,,,,"Preguntas frecuentes 

[{""question"":""¿Qué tamaño conviene para que se lea bien?” 
“answer”:”Depende de la distancia. Para zonas de paso amplias conviene un formato mayor y titulares grandes. Si nos dices ubicación y distancia aproximada, te lo recomendamos.""}, 

{""question"":""¿Mejor una cara o dos caras?” 
“answer”:”Doble cara cuando hay tránsito en ambos sentidos. Una cara si irá contra pared o en un punto orientado.""}, 

{""question"":""¿Se puede reutilizar?” 
“answer”:”Sí. Para reutilización recomendamos materiales más resistentes (por ejemplo PVC) y un acabado protector si va a moverse o manipularse.""}, 

{""question"":""¿Podéis hacerlo con forma especial?” 
“answer”:”Sí, podemos producir tótems con corte a medida (siluetas, flechas, formas de producto, etc.).""}] ",,"https://webcms.blob.core.windows.net/media/product/expositores/totem.webp","1.200","1.200","alt descripció de la foto","[]","$0,00","0","EUR","Verdadero","0","Tótems Publicitarios Personalizados | Expositores de Suelo a Medida","[{""label"":""Tamaño"",""name"":""tamaño"",""type"":""select"",""required"":true,""options"":[""70x200 cm"",""100x200 cm"",""150x200 cm""]},{""label"":""Impresión"",""name"":""impresión"",""type"":""select"",""required"":true,""options"":[""Cuatricromía 1 cara""]},{""label"":""Material"",""name"":""material"",""type"":""select"",""required"":true,""options"":[""Cartón pluma 10 mm"",""Nido de abeja 10 mm""]},{""label"":""Acabados"",""name"":""acabados"",""type"":""select"",""required"":true,""options"":[""Corte recto o a la forma""]},{""label"":""Cantidad"",""name"":""cantidad"",""type"":""number"",""required"":true},{""label"":""Observaciones"",""name"":""observaciones"",""type"":""text"",""required"":false}]",,"Tótems personalizados para ferias, eventos y punto de venta. Expositores de suelo en rígidos, a una o dos caras, con corte a medida y opciones de base. Solicita presupuesto.","https://reprodisseny.com/productos/totems","[{""lang"":""es-ES"",""url"":""https://reprodisseny.com/productos/totems""},{""lang"":""ca-ES"",""url"":""https://reprodisseny.com/productos/totems""}]","[""totems""]","{}","[""totems""]","[]",,,"[]",,,,,,"False"
"Encuadernación  Wire O Oculto","encuadernacion-wire-o-oculto","Verdadero",,"libros-revistas-catalogos","01-PUBLI-0005","Reprodisseny",,"La encuadernación Wire-O oculto combina lo mejor de dos mundos: la comodidad del Wire-O (abre en plano y gira 360º) con un acabado más elegante, ya que la espiral queda oculta por la tapa. Es una opción ideal para catálogos, dossiers y presentaciones donde importa tanto la funcionalidad como la calidad percibida.","##Detalles 

¿Qué es la encuadernación Wire-O oculto y para qué se usa? 

Es una variante del Wire-O en la que la doble espiral metálica no queda visible por fuera: se integra mediante una tapa diseñada para cubrir el lomo, ofreciendo un aspecto más limpio y “editorial”. Se utiliza cuando necesitas un documento práctico para consulta, pero con una presentación más premium: catálogos de marca, portfolios, propuestas comerciales, documentación corporativa o material formativo de alta calidad. 

##Beneficios 

Apertura 360º y en plano: igual de funcional que el Wire-O tradicional. 

Espiral oculta: aspecto más elegante y profesional en mano y sobre mesa. 

Mejor calidad percibida: ideal para entregas comerciales y documentación de marca. 

Más protección del lomo: la tapa ayuda a proteger la encuadernación frente a roces. 

Perfecto para presentaciones: se mantiene abierto sin cerrarse, con estética cuidada. 

##Aplicaciones 

Catálogos de producto y tarifas de consulta (con acabado de marca). 

Dossiers comerciales y propuestas para clientes. 

Portfolios y presentaciones creativas (arquitectura, diseño, fotografía). 

Manual corporativo o formativo con uso recurrente pero imagen premium. 

Documentación interna de alta calidad (procedimientos, guías, onboarding). 

##Características técnicas 

Formato 

Habituales: A4, A5, apaisado o a medida según el contenido. 

Wire-O y perforado 

Perforado alineado + doble espiral metálica, con diámetro ajustado al grosor del documento. 

Tapa para ocultar la espiral 

Cubierta diseñada para cubrir el lomo y dejar el Wire-O “escondido” en la parte trasera. 

Aporta una estética más limpia y una sensación más “libro” sin perder apertura 360º. 

Papeles 

Interior: offset (lectura) o estucado mate/brillo (imagen) según objetivo. 

Cubierta: cartulina de mayor gramaje para rigidez y presencia. 

Acabados recomendados 

Laminado mate o brillo en cubierta para proteger y mejorar calidad percibida. 

Soft touch (opcional) para un tacto más premium. 

Esquinas redondeadas (opcional) si el uso será intensivo. ",,,,,,,"Preguntas frecuentes 

[{""question"":""¿En qué se diferencia del Wire-O normal?” 
“answer”:”La funcionalidad es la misma (abre 360º), pero en Wire-O oculto la espiral queda tapada por la cubierta, con un acabado más elegante.""}, 

{""question"":""¿Cuándo merece la pena elegirlo?” 
“answer”:”Cuando el documento es parte de tu imagen de marca (catálogo, dossier, portfolio) y quieres un acabado más premium sin renunciar a la comodidad.""}, 

{""question"":""¿Se abre igual de bien?” 
“answer”:”Sí. Mantiene la apertura en plano y la posibilidad de girar páginas completamente.""}, 

{""question"":""¿Qué necesitáis para presupuestar?” 
“answer”:”Formato, número de páginas, cantidad, tipo de papel y si quieres laminado/soft touch en cubierta.""}]",,"https://webcms.blob.core.windows.net/media/product/publicaciones/encuadernacion-wire-oculto.webp","1.200","1.200","alt descripció de la foto","[]","$0,00","0","EUR","Verdadero","0","Encuadernación Wire-O oculto | Apertura 360º con acabado más premium","[{""label"":""Tamaño"",""name"":""tamaño"",""type"":""select"",""required"":true,""options"":[""Din A-5"",""Din A-4"",""personalizado""]},{""label"":""Impresión"",""name"":""impresión"",""type"":""select"",""required"":true,""options"":[""Cuatricromía 2 caras""]},{""label"":""Páginas"",""name"":""paginas"",""type"":""number"",""required"":true},{""label"":""Papel cubierta"",""name"":""papel cubierta"",""type"":""select"",""required"":true,""options"":[""Estucado mate"",""Estucado brillo"",""Offset"",""Especial""]},{""label"":""Papel interior"",""name"":""papel interior"",""type"":""select"",""required"":true,""options"":[""Estucado mate"",""Estucado brillo"",""Offset"",""Reciclado""]},{""label"":""Acabados cubierta"",""name"":""acabados cubierta"",""type"":""select"",""required"":true,""options"":[""Plastificado brillo"",""Plastificado mate""]},{""label"":""Wire-O"",""name"":""encuadernación"",""type"":""select"",""required"":true,""options"":[""Blanco"",""Negro"",""Color""]},{""label"":""Cantidad"",""name"":""cantidad"",""type"":""number"",""required"":true}]",,"Encuadernación Wire-O oculto para catálogos, dossiers y presentaciones: apertura 360º, páginas en plano y espiral oculta en la tapa. Más estética y profesional. Solicita presupuesto.","https://reprodisseny.com/productos/wire-o-oculto","[{""lang"":""es-ES"",""url"":""https://reprodisseny.com/productos/wire-o-oculto""},{""lang"":""ca-ES"",""url"":""https://reprodisseny.com/productos/wire-o-oculto""}]","[""encuadernación  wire o oculto""]","{}","[""encuadernación  wire o oculto""]","[]",,,"[]",,,,,,"False"
