"Title","Slug","IsPublished","SortOrder","PrimaryCategory","Sku","Brand","Categories","ShortDescription","BodyMd","DetailsMd","BenefitsMd","MaterialsMd","FinishesMd","TechnicalSpecsMd","ApplicationsMd","FaqsJson","PublishedAt","ImageSrc","ImageWidth","ImageHeight","ImageAlt","GalleryImagesJson","Price","ReviewCount","PriceCurrency","InStock","RatingValue","MetaTitle","FormFieldsJson","FormatsMd","MetaDescription","Canonical","HrefLangJson","KeywordsJson","SchemaJson","SearchTermsJson","AttributesJson","Gtin13","Mpn","VariantsJson","LegacySlugsJson","RobotsOverride","RobotsAdvanced","OgImageSrc","Path","NoIndex"
"Abanicos personalizados para eventos","abanicos-personalizados-eventos","Verdadero",,"eventos","01-EVEN-0010","Reprodisseny",,"Los abanicos personalizados son un detalle útil y muy visible en eventos con calor: mejoran la experiencia del asistente y, a la vez, hacen que tu marca esté presente en fotos, vídeos y durante todo el acto. En Repro Disseny producimos abanicos para bodas, eventos corporativos, festivales y acciones de marca, con impresión cuidada y opciones de formato según el uso.",,"##Detalles
¿Qué es un abanico personalizado y para qué se usa?
Un abanico personalizado es una pieza de merchandising pensada para refrescar y comunicar. Puede ser un abanico plegable (con varillas) o un abanico tipo pai pai (mango y superficie rígida), e incluye diseño, logo, claim, fecha del evento o incluso nombres de invitados. Se utiliza especialmente en eventos al aire libre o de verano, donde el abanico pasa a ser un “must” que el público agradece… y recuerda.
","##Beneficios
Útil de verdad: mejora el confort del asistente en exteriores, carpas, terrazas o eventos con mucha gente.
Alta visibilidad de marca: tu logo y mensajes se ven durante todo el evento y aparecen en fotos y contenido social.
Detalle memorable: funciona como obsequio práctico y refuerza la experiencia del evento sin complicaciones.
Personalización por tipo de público: versiones para invitados, staff, VIP, patrocinadores o diferentes zonas del evento.
Fácil de repartir: ligero, cómodo y perfecto para packs de bienvenida o entrega en accesos.
",,"Acabado mate recomendado cuando habrá mucha luz o fotos (reduce reflejos).
Acabado brillo si buscas colores más vivos y un efecto más llamativo.
Opción de empaquetado por sets o preparación para entrega (packs de bienvenida).
",,"##Aplicaciones
Bodas y celebraciones: abanicos con fecha, iniciales o seating para ceremonias en exterior.
Eventos corporativos: congresos, inauguraciones, presentaciones y jornadas de verano.
Ferias y activaciones de marca: reparto en stand o acciones de street marketing con alto flujo.
Festivales y eventos culturales: merchandising útil y visible en recintos al aire libre.
Hostelería en eventos: terrazas, caterings y eventos con servicio (detalle práctico para invitados).
","Preguntas frecuentes
[{""question"":""¿Mejor abanico plegable o pai pai?""
“answer”:”El plegable suele percibirse más “regalo” y se usa durante más tiempo; el pai pai es muy práctico para repartir rápido en accesos o acciones masivas.""},
{""question"":""¿Se pueden personalizar con nombres o para diferentes mesas?""
“answer”:”Sí. Podemos preparar variantes o datos variables (por ejemplo, nombre del invitado, mesa o grupo) si nos facilitas el listado.""},
{""question"":""¿Qué acabado recomendáis para exteriores con sol?""
“answer”:”Normalmente mate, porque evita brillos y mejora la lectura en luz directa (además queda mejor en fotos).""},
{""question"":""¿Podéis diseñarlo o adaptar el archivo para imprenta?""
“answer”:”Sí. Revisamos medidas, márgenes y preparación del arte final para que el resultado quede limpio y profesional.""}]
",,"https://webcms.blob.core.windows.net/media/product/eventos/abanicos.webp","1.200","1.200","alt descripció de la foto","[]","$0,00","0","EUR","Verdadero","0","Abanicos Personalizados para Eventos | Merchandising Impreso","[{""label"":""Tamaño"",""name"":""tamaño"",""type"":""select"",""required"":true,""options"":[""30 x 15 cm""]},{""label"":""Impresión"",""name"":""impresión"",""type"":""select"",""required"":true,""options"":[""Cuatricromía 2 caras""]},{""label"":""Papel"",""name"":""papel"",""type"":""select"",""required"":true,""options"":[""Cartulina gráfica de 350 gr.""]},{""label"":""Troquelado"",""name"":""troquelado"",""type"":""select"",""required"":true,""options"":[""A la forma""]},{""label"":""Cantidad"",""name"":""cantidad"",""type"":""number"",""required"":true},{""label"":""Observaciones"",""name"":""observaciones"",""type"":""text"",""required"":false}]","Abanico plegable: el clásico con varillas, pensado para uso continuado y “efecto regalo”.
Abanico tipo pai pai: ligero y rápido de repartir, ideal para accesos y grandes cantidades.
Tamaños estándar o a medida según el diseño y la superficie de impresión.
Materiales
Opciones en papel/cartulina para pai pai, con buen cuerpo para que no se doble con facilidad.
Opciones con varillas (según modelo) para abanico plegable, pensadas para un uso cómodo.
Alternativas más resistentes si el evento exige mucha manipulación o duración.
Impresión y personalización
Impresión a color con posibilidad de diseño por caras según el formato.
Personalización con datos (si lo necesitas): nombres, mesas, códigos o versiones por patrocinador.
Integración de QR (opcional): para agenda, mapa del evento, redes, landing o sorteos.
","Abanicos personalizados para bodas, ferias y eventos de verano. Impresión a color, opciones plegables o tipo pai pai y personalización con nombres o marca. Solicita presupuesto.","https://reprodisseny.com/productos/abanicos","[{""lang"":""es-ES"",""url"":""https://reprodisseny.com/productos/abanicos""},{""lang"":""ca-ES"",""url"":""https://reprodisseny.com/productos/abanicos""}]","[""abanicos""]","{}","[""abanicos""]","[]",,,"[]",,,,,,"Verdadero"
"Acreditaciones personalizadas para eventos","acreditaciones-personalizadas-eventos","Verdadero",,"eventos","01-EVEN-0003","Reprodisseny",,"Las acreditaciones son clave para organizar accesos, identificar asistentes y reforzar la imagen del evento. Imprimimos acreditaciones personalizadas con materiales pensados para la duración y la manipulación, y opciones como datos variables, numeración o QR para un control más ágil.",,"¿Qué es una acreditación y para qué se usa?
Una acreditación es una tarjeta de identificación para asistentes, ponentes, staff o proveedores. Normalmente incluye nombre, empresa, cargo, tipo de acceso (VIP, prensa, staff…), fecha y elementos de control como QR/código de barras o numeración.
Además de ordenar el evento, ayuda a que todo el equipo y los asistentes se identifiquen rápidamente y mejora la sensación de profesionalidad desde el primer minuto.","•	Control y organización: identificación rápida por roles (staff, ponente, invitado, expositor…).
•	Más fluidez en accesos: con QR/código o numeración para validación y check-in.
•	Imagen coherente de marca: acreditaciones alineadas con el diseño del evento, patrocinadores y señalética.
•	Personalización eficiente: impresión con datos variables para listas grandes (nombres/empresas/categorías).
•	Comodidad durante el evento: formatos pensados para llevar en cuello con lanyard o en funda/clip (según necesidad).",,,"Formatos habituales
• Medidas estándar (tipo acreditación) o a medida, según diseño y uso.
• Orientación vertical u horizontal.
Materiales (según duración y uso)
• Cartulina: opción práctica para eventos de corta duración con buena presencia.
• Material sintético (tipo “papel plástico”): recomendado cuando habrá mucho uso o riesgo de humedad/roce.
• PVC (si buscas máxima durabilidad): ideal para acreditaciones reutilizables o de larga vida (por ejemplo, personal interno o accesos recurrentes).
Impresión
• Color o 1 tinta, a una o dos caras (por ejemplo, datos delante y agenda/plano/normas detrás).
Personalización y control
• Datos variables: nombre, empresa, cargo, categoría, etc.
• QR / código de barras: check-in, descarga de entradas, agenda, mapas o validación.
• Numeración: control interno o por lotes.
Troquel y perforaciones
• Agujero/redondeo y troquel cuando el formato lo requiera (p. ej., para colgar o encajar en funda).
Acabados recomendados
• Laminado mate o brillo: protege frente a roces y mejora la presencia (muy útil si se manipulan mucho).
• Soft touch / barniz selectivo (opcional): para eventos premium o acreditaciones VIP.","• Ferias y congresos: asistentes, expositores, ponentes, prensa y organización.
• Eventos corporativos y formaciones: convenciones internas, entregas, presentaciones.
• Eventos culturales y deportivos: festivales, competiciones, zonas de acceso y staff.
• Acciones de marca y activaciones: control de acceso, equipos itinerantes, promotores.","Preguntas frecuentes
[{""question"":""¿Podéis imprimir acreditaciones con nombres diferentes?”
“answer”:”Sí, trabajamos con datos variables para personalizar cada acreditación (nombres, empresas, roles, etc.).""},
{""question"":""¿Qué material recomendáis si el evento dura varios días?”
“answer”:”Normalmente un soporte más resistente (material sintético o con laminado) para aguantar mejor el uso y el roce.""},
{""question"":""¿Se pueden incluir QR o códigos para control de acceso?”
“answer”:”Sí, podemos integrar QR/código de barras y numeración según el sistema de acceso o check-in que utilices.""},
{""question"":""¿Podéis hacerlas con lanyard?”
“answer”:”Sí, si necesitas el pack completo, podemos prepararlo con lanyards y la configuración que mejor encaje con el uso del evento.""}]
",,"https://webcms.blob.core.windows.net/media/product/eventos/acreditaciones.webp","1.200","1.200","alt descripció de la foto","[]","$0,00","0","EUR","Verdadero","0","Acreditaciones Personalizadas para Eventos | Impresión Profesional","[{""label"":""Tamaño"",""name"":""tamaño"",""type"":""select"",""required"":true,""options"":[""5"",""5x 8"",""5 cm"",""9x12 cm""]},{""label"":""Impresión"",""name"":""impresión"",""type"":""select"",""required"":true,""options"":[""1 cara"",""2 caras""]},{""label"":""Tintas"",""name"":""tintas"",""type"":""select"",""required"":true,""options"":[""Cuatricromía""]},{""label"":""Papel"",""name"":""papel"",""type"":""select"",""required"":true,""options"":[""Estucado mate 300 gr"",""Cartulina extra 300 gr"",""Conqueror 300 gr.""]},{""label"":""Corte"",""name"":""corte"",""type"":""select"",""required"":true,""options"":[""Corte recto y orificio superior""]},{""label"":""Esquinas redondeadas"",""name"":""esquinas"",""type"":""select"",""required"":true,""options"":[""Si"",""No""]},{""label"":""Cantidad"",""name"":""cantidad"",""type"":""number"",""required"":true},{""label"":""Observaciones"",""name"":""observaciones"",""type"":""text"",""required"":false}]",,"Acreditaciones personalizadas para ferias, congresos y eventos corporativos. Con datos variables, QR y opciones con lanyard. Pide presupuesto a Repro Disseny.","https://reprodisseny.com/productos/acreditaciones","[{""lang"":""es-ES"",""url"":""https://reprodisseny.com/productos/acreditaciones""},{""lang"":""ca-ES"",""url"":""https://reprodisseny.com/productos/acreditaciones""}]","[""acreditaciones""]","{}","[""acreditaciones""]","[]",,,"[]",,,,,,"Verdadero"
"Agendas personalizadas","agendas-personalizadas","Verdadero",,"material-oficina","01-OFICI-0024","Reprodisseny",,"Las agendas personalizadas son un regalo corporativo útil y con alta permanencia: se usan a diario y mantienen tu marca presente durante todo el año. En Repro Disseny producimos agendas corporativas con diferentes formatos, tapas y encuadernaciones, y con opción de interior estándar o personalizado para adaptarlas a tu forma de trabajar (reuniones, planificación, objetivos, etc.).",,"¿Qué es una agenda personalizada y para qué se usa? 
Una agenda personalizada es una libreta/planificador con estructura de calendario (diaria, semanal o mensual) que incluye la identidad visual de la empresa en portada (y si se desea, también en el interior). Se utiliza para organización interna, planificación de equipos, packs de bienvenida, acciones comerciales y regalos a clientes o partners, porque combina utilidad real + imagen de marca. ","Marca presente todo el año: alta permanencia y uso diario. 
Útil de verdad: mejora la organización de equipo, reuniones y planificación. 
Calidad percibida: transmite profesionalidad en regalos corporativos. 
Personalización completa: portada, contraportada e interior (plantillas, secciones, KPI, reuniones). 
Perfecta para acciones comerciales: ideal para fidelización, packs y campañas de fin de año. ",,,"Formatos habituales 
A5 (el más cómodo para diario), A4 (más espacio) y formatos a medida. 
Tipos de agenda 
Semanal (muy habitual): visión clara de la semana. 
Diaria: más espacio para anotaciones y tareas. 
Mensual: visión rápida para planificación general. 
Opción de combinar secciones (mensual + semanal + notas). 
Tapas 
Tapa blanda: ligera y práctica. 
Tapa dura: más resistente y premium (ideal para regalo corporativo). 
Encuadernación 
Wire-O: apertura 360º y en plano (muy práctica). 
Encolada/cosida: acabado más “editorial”, según el estilo de agenda. 
Interior personalizado (opcional) 
Secciones a medida: reuniones, to-do, planning, objetivos, proyectos, contactos, KPI. 
Personalización por departamentos o sedes si lo necesitas. 
Acabados recomendados 
Laminado mate o brillo en tapa para proteger (mate suele ser más elegante). 
Soft touch para un tacto premium. 
Barniz selectivo o stamping para detalles de marca (logo/título). 
Extras opcionales según modelo: goma elástica, marcapáginas, bolsillo interior. ","Agendas corporativas para empleados (uso interno y planificación). 
Regalo a clientes y partners (Navidad, cierre de año, acciones comerciales). 
Welcome packs (incorporaciones, formación, eventos). 
Equipos comerciales: seguimiento de leads, visitas, rutas, objetivos. 
Centros y entidades: organización de cursos, academias, asociaciones. ","Preguntas frecuentes 

[{""question"":""¿Semanal o diaria?” 
“answer”:”Semanal es la más equilibrada para la mayoría de equipos. Diaria si necesitas mucho espacio de anotación y control.""}, 

{""question"":""¿Se puede personalizar el interior con nuestras plantillas?” 
“answer”:”Sí. Podemos crear un interior adaptado a tu operativa (reuniones, proyectos, objetivos).""}, 

{""question"":""¿Qué opción es mejor para regalo corporativo?” 
“answer”:”Suele funcionar muy bien tapa dura + acabado mate/soft touch y un detalle premium (stamping o barniz).""}, 

{""question"":""¿Podéis hacer diferentes versiones por sedes o departamentos?” 
“answer”:”Sí, manteniendo el diseño base y cambiando datos o secciones.""}] ",,"https://webcms.blob.core.windows.net/media/product/publicidad-oficina/oficina/agendas-personalizadas.webp","1.200","1.200","alt descripció de la foto","[]","$0,00","0","EUR","Verdadero","0","Agendas personalizadas | Agendas corporativas para equipos, clientes y eventos","[{""label"":""Tamaño"",""name"":""tamaño"",""type"":""select"",""required"":true,""options"":[""Din A-5"",""Din A-4""]},{""label"":""Impresión"",""name"":""impresión"",""type"":""select"",""required"":true,""options"":[""Cuatricromía 2 caras""]},{""label"":""Papel cubiertas"",""name"":""papel cubiertas"",""type"":""select"",""required"":true,""options"":[""Estucado mate 350 gr."",""Cartulina gráfica 350 gr.""]},{""label"":""Acabados cubierta"",""name"":""acabados cubierta"",""type"":""select"",""required"":true,""options"":[""Sin plastificar"",""Plastificado mate 2 caras"",""Plastificado brillo 2 caras""]},{""label"":""Papel interior"",""name"":""papel interior"",""type"":""select"",""required"":true,""options"":[""Offset 80 gr."",""Offset 90 gr."",""Reciclado 80 gr.""]},{""label"":""Encuadernación"",""name"":""encuadernación"",""type"":""select"",""required"":true,""options"":[""Wire-O"",""Rústica cosida"",""Tapa dura cosida""]},{""label"":""Cantidad"",""name"":""cantidad"",""type"":""number"",""required"":true},{""label"":""Observaciones"",""name"":""observaciones"",""type"":""text"",""required"":false}]",,"Agendas personalizadas para empresa: formatos A5/A4, tapa blanda o dura, encuadernación Wire-O o cosida/encolada y opción de interior personalizado. Ideal para regalos corporativos. Solicita presupuesto.","https://reprodisseny.com/productos/agendas-personalizadas","[{""lang"":""es-ES"",""url"":""https://reprodisseny.com/productos/agendas-personalizadas""},{""lang"":""ca-ES"",""url"":""https://reprodisseny.com/productos/agendas-personalizadas""}]","[""agendas personalizadas""]","{}","[""agendas personalizadas""]","[]",,,"[]",,,,,,"Verdadero"
"Árbol de Navidad corporativo personalizado","arbol-navidad-corporativo","Verdadero",,"eventos","01-EVEN-0017","Reprodisseny","[""expositores""]","Un árbol de Navidad puede ser mucho más que decoración: es un punto de foto, un reclamo de marca y una pieza perfecta para ambientar espacios comerciales o eventos. En Repro Disseny producimos árboles de Navidad impresos sobre nido de abeja, troquelados a la forma y automontables en dos piezas, para que el montaje sea rápido y el resultado se vea profesional.",,"¿Qué es un árbol de Navidad impreso y para qué se usa?
Es una figura navideña en gran formato, impresa a todo color y fabricada en cartón nido de abeja, que se entrega troquelada y se monta encajando dos piezas (estructura en cruz). Se utiliza para decorar y señalizar espacios durante campañas de Navidad, reforzando marca y creando un punto visual atractivo para clientes, empleados o asistentes.","• Montaje rápido y sin herramientas: sistema automontable en dos piezas (encaje).
• Impacto visual en poco espacio: ideal para entradas, escaparates, recepciones o stands.
• Ligero y fácil de transportar: se entrega plano y ocupa poco en almacenaje.
• Personalizable al 100%: diseño, forma, mensajes, colores, patrocinadores, QR, etc.
• Solución más sostenible: el nido de abeja es un material ligero y reciclable, perfecto para campañas estacionales.",,,"Material
• Cartón nido de abeja: muy ligero, con buena rigidez para piezas autoportantes.
Troquelado a la forma
• Corte a medida siguiendo el contorno del árbol (y, si se desea, con formas internas o detalles).
Sistema automontable (2 piezas)
• Dos piezas que se encajan para formar una estructura estable en cruz.
• Diseñado para montar y desmontar de forma práctica durante campaña.
Medidas
• Tamaños a medida según el espacio y la distancia de visualización (desde formatos compactos hasta gran formato).
Impresión y personalización
• Impresión a color con posibilidad de incluir:
• logo y mensaje corporativo,
• patrocinadores,
• QR (promoción, sorteo, campaña, catálogo),
• variantes por tienda/sede (si necesitas diferentes diseños).
Acabados (según uso)
• Opciones de protección si va a estar en zona de mucho paso o manipulación.
• Preparación para entrega y montaje (embalaje y etiquetado por unidades si lo necesitas).","• Tiendas y centros comerciales: escaparates, pasillos, zonas de caja o promociones navideñas.
• Empresas y oficinas: recepciones, salas comunes, eventos internos y campañas corporativas.
• Ferias y eventos: decoración de stand, photocall navideño, puntos de bienvenida.
• Hostelería: hoteles, restaurantes y espacios de celebración (zonas de paso y entradas).
• Activaciones de marca: acciones con foto + QR a sorteo, landing, catálogo o redes.","Preguntas frecuentes
[{""question"":""¿Se monta realmente sin herramientas?”
“answer”:”Sí. Es automontable: se entregan dos piezas troqueladas que encajan entre sí.""},
{""question"":""¿Se puede reutilizar?”
“answer”:”Sí, especialmente si se cuida en montaje/desmontaje y se almacena plano. Si necesitas una solución más “de batalla”, te proponemos la opción más resistente según el uso.""},
{""question"":""¿Podéis hacerlo con la forma de nuestra marca o un diseño especial?”
“answer”:”Sí. Además del árbol clásico, podemos hacer siluetas personalizadas manteniendo el sistema automontable.""},
{""question"":""¿Qué necesitáis para presupuestarlo?”
“answer”:”Medida aproximada, ubicación (interior/exterior), cantidad y si quieres diseño nuevo o aportas arte final.""}]
",,"https://webcms.blob.core.windows.net/media/product/eventos/arbol-de-navidad.webp","1.200","1.200","alt descripció de la foto","[]","$0,00","0","EUR","Verdadero","0","Árbol de Navidad Corporativo Personalizado | Nido de Abeja Troquelado","[{""label"":""Tamaño"",""name"":""tamaño"",""type"":""select"",""required"":true,""options"":[""39x53 cm"",""81x149 cm""]},{""label"":""Impresión"",""name"":""impresión"",""type"":""select"",""required"":true,""options"":[""2 caras""]},{""label"":""Tintas"",""name"":""tintas"",""type"":""select"",""required"":true,""options"":[""Cuatricromía""]},{""label"":""Material"",""name"":""material"",""type"":""select"",""required"":true,""options"":[""Cartón nido de abeja 10 mm""]},{""label"":""Cantidad"",""name"":""cantidad"",""type"":""number"",""required"":true},{""label"":""Observaciones"",""name"":""observaciones"",""type"":""text"",""required"":false},{""label"":""Tamaño"",""name"":""tamaño"",""type"":""select"",""required"":true,""options"":[""39x53 cm"",""81x149 cm""]},{""label"":""Impresión"",""name"":""impresión"",""type"":""select"",""required"":true,""options"":[""2 caras""]},{""label"":""Tintas"",""name"":""tintas"",""type"":""select"",""required"":true,""options"":[""Cuatricromía""]},{""label"":""Material"",""name"":""material"",""type"":""select"",""required"":true,""options"":[""Cartón nido de abeja 10 mm""]},{""label"":""Cantidad"",""name"":""cantidad"",""type"":""number"",""required"":true},{""label"":""Observaciones"",""name"":""observaciones"",""type"":""text"",""required"":false}]",,"Árbol de Navidad corporativo impreso en nido de abeja, troquelado a medida y automontable en 2 piezas. Ligero, estable y fácil de transportar. Solicita presupuesto.","https://reprodisseny.com/productos/arbol-navidad","[{""lang"":""es-ES"",""url"":""https://reprodisseny.com/productos/arbol-navidad""},{""lang"":""ca-ES"",""url"":""https://reprodisseny.com/productos/arbol-navidad""}]","[""árbol de navidad""]","{}","[""árbol de navidad""]","[]",,,"[]",,,,,,"Verdadero"
