"Title","Slug","IsPublished","SortOrder","PrimaryCategory","Sku","Brand","Categories","ShortDescription","BodyMd","DetailsMd","BenefitsMd","MaterialsMd","FinishesMd","TechnicalSpecsMd","ApplicationsMd","FaqsJson","PublishedAt","ImageSrc","ImageWidth","ImageHeight","ImageAlt","GalleryImagesJson","Price","ReviewCount","PriceCurrency","InStock","RatingValue","MetaTitle","FormFieldsJson","FormatsMd","MetaDescription","Canonical","HrefLangJson","KeywordsJson","SchemaJson","SearchTermsJson","AttributesJson","Gtin13","Mpn","VariantsJson","LegacySlugsJson","RobotsOverride","RobotsAdvanced","OgImageSrc","Path","NoIndex"
"Panel de Dibond (composite de aluminio)","panel-dibond-personalizado","Verdadero",,"material-rigido","01-GRFO-0012","Reprodisseny",,"El panel de Dibond (composite de aluminio) es una de las opciones más fiables cuando necesitas un soporte rígido con acabado premium y máxima estabilidad, especialmente en exterior. En Repro Disseny imprimimos paneles de Dibond a medida para rótulos, señalización y cartelería corporativa, con opción de una o dos caras y corte recto o a la forma.","##Detalles 

¿Qué es un panel de Dibond y para qué se usa? 

Un panel de Dibond es un soporte rígido formado por dos láminas de aluminio con un núcleo interior (material compuesto). Esta estructura le da una gran planimetría (se mantiene muy plano), buena resistencia y un acabado muy profesional. 
Se usa mucho para señalética, rótulos, placas corporativas, cartelería de larga duración y piezas que deben aguantar bien en exterior. 

##Beneficios 

Muy estable y duradero: ideal para exterior y uso prolongado. 

Acabado premium: aporta una imagen corporativa sólida y profesional. 

No se comba fácilmente: excelente planimetría en formatos grandes. 

Versátil: sirve para rótulos, placas, señalización y cartelería fija. 

Personalizable: tamaños, grosores, una o dos caras y corte a medida. 

##Aplicaciones 

Rótulos y placas de fachada (identificación de negocio). 

Señalética corporativa (interior/exterior): direcciones, normativa, zonas, horarios. 

Cartelería rígida para campañas de larga duración en exterior. 

Ferias y eventos: paneles de stand y piezas reutilizables con presencia premium. 

Placas informativas (obras, inmuebles, señalización institucional). 

##Características técnicas 

Medidas y grosores 

Formatos estándar o totalmente a medida. 

Diferentes grosores según tamaño, rigidez y tipo de instalación. 

Impresión 

Impresión a todo color con buena definición para logos, tipografías e imágenes. 

Opción a una o dos caras si el panel se verá desde ambos sentidos. 

Corte y mecanizados 

Corte recto o corte a medida (contornos, flechas, formas de producto). 

Posibilidad de taladros, ranuras o preparaciones para tornillería/separadores (según montaje). 

Acabados recomendados 

Acabado mate si quieres menos reflejos o habrá iluminación directa. 

Posible protección extra si la pieza estará en zona de roce o manipulación (según uso). 

Instalación 

Opciones habituales: atornillado, separadores (efecto flotante), fijación sobre estructura o montaje en pared. 

Si nos indicas dónde irá (fachada/interior) te recomendamos el sistema más limpio y estable.",,,,,,,"Preguntas frecuentes 

[{""question"":""¿Es adecuado para exterior?” 
“answer”:”Sí, es uno de los soportes más usados para exterior por su estabilidad y resistencia.""}, 

{""question"":""¿Dibond o Forex?” 
“answer”:”Para exterior o instalaciones de larga duración, Dibond suele ser más estable y premium. Forex es muy versátil en interior y campañas, pero normalmente no ofrece el mismo comportamiento “de largo plazo” en exterior.""}, 

{""question"":""¿Se puede hacer con forma personalizada?” 
“answer”:”Sí, mediante corte a medida y mecanizado si lo necesitas.""}, 

{""question"":""¿Qué grosor necesito?” 
“answer”:”Depende del tamaño y del montaje (atornillado, separadores, estructura). Con medidas y ubicación, te lo indicamos rápido.""}]",,"https://webcms.blob.core.windows.net/media/product/gran-formato/material-rigido/dibond.webp","1.200","1.200","alt descripció de la foto","[]","$0,00","0","EUR","Verdadero","0","Panel de Dibond personalizado | Impresión en composite de aluminio a medida","[{""label"":""Tamaño"",""name"":""tamaño"",""type"":""select"",""required"":true,""options"":[""Personalizado a demanda""]},{""label"":""Impresión"",""name"":""impresión"",""type"":""select"",""required"":true,""options"":[""Cuatricromía 1 cara""]},{""label"":""Material"",""name"":""material"",""type"":""select"",""required"":true,""options"":[""Dibond 3 mm""]},{""label"":""Color"",""name"":""color"",""type"":""select"",""required"":true,""options"":[""Blanco trasera blanca"",""gris cepillado trasera blanca""]},{""label"":""Fresado"",""name"":""fresado"",""type"":""select"",""required"":true,""options"":[""Recto"",""A la forma""]},{""label"":""Cantidad"",""name"":""cantidad"",""type"":""number"",""required"":true},{""label"":""Observaciones"",""name"":""observaciones"",""type"":""text"",""required"":false}]",,"Panel de Dibond (composite de aluminio) impreso a medida para rótulos, señalética y exterior. Resistente, estable y con corte a medida. Solicita presupuesto.","https://reprodisseny.com/productos/dibon","[{""lang"":""es-ES"",""url"":""https://reprodisseny.com/productos/dibon""},{""lang"":""ca-ES"",""url"":""https://reprodisseny.com/productos/dibon""}]","[""dibon""]","{}","[""dibon""]","[]",,,"[]",,,,,,"False"
"Diplomas personalizados para eventos","diplomas-personalizados-eventos","Verdadero",,"eventos","01-EVEN-0002","Reprodisseny",,"Un diploma es mucho más que un papel: es el cierre de una experiencia. Imprimimos diplomas personalizados para eventos, formaciones, entregas de premios y actos corporativos, cuidando papel, color y acabados para que el resultado tenga presencia y sea coherente con tu marca.","##Detalles
¿Qué es un diploma y para qué se usa?
Un diploma impreso es una pieza de reconocimiento (asistencia, superación, participación o premio) que suele incluir nombre, entidad organizadora, fecha, firma/sello y, si aplica, número de registro o código.
En eventos y formaciones funciona como un elemento de valor: refuerza la percepción de profesionalidad, crea recuerdo y, en entornos corporativos, aporta formalidad al acto de entrega.

##Beneficios
•	Imagen más profesional del evento: un buen papel y una impresión cuidada elevan la percepción del acto y de la organización.
•	Personalización total: nombres, cargos, fechas, centros, categorías, numeración… ideal para entregas con muchos asistentes.
•	Lectura clara y elegante: tipografías y composición pensadas para que el diploma “se entienda” a primera vista.
•	Acabados que marcan la diferencia: opciones premium para ceremonias, galas, graduaciones o reconocimientos corporativos.
•	Entrega lista para usar: podemos preparar formatos y packs pensados para facilitar la entrega (por ejemplo, con carpetas o presentación).

##Aplicaciones
•	Cursos, talleres y formaciones (presencial u online con entrega física).
•	Eventos corporativos: reconocimientos internos, premios, convenciones, aniversarios de empresa.
•	Centros educativos: graduaciones, menciones, concursos, diplomas de participación.
•	Eventos deportivos y culturales: torneos, certámenes, festivales, competiciones por categorías.
•	Asociaciones y entidades: acreditaciones, reconocimientos, voluntariado, jornadas y congresos.

##Características técnicas
Para que un diploma tenga buena presencia y dure, estas son las claves que solemos definir:
Formatos habituales
•	A4 (el más común) y A3 (para entrega más “impactante”).
•	Orientación vertical u horizontal, según diseño y estilo del evento.
Impresión
•	Color (cuatricromía) o 1 tinta (más sobrio/institucional).
•	Una cara (lo más frecuente) o doble cara si quieres incluir programa, texto conmemorativo o condiciones en el reverso.
Papeles recomendados (según objetivo)
•	Papeles de mayor gramaje para un diploma con cuerpo y presencia.
•	Opciones estucadas, mate o con textura para un acabado más elegante.
•	Alternativas recicladas si buscas un enfoque más sostenible.
Personalización con datos variables
•	Impresión de nombres y apellidos, cargos, categorías, nº de diploma, etc., manteniendo la misma estética en toda la serie.
•	Posibilidad de incluir QR (validación, descarga de contenido, landing del evento) o códigos de control.
Acabados opcionales
•	Laminado mate o brillo (si necesitas más protección frente a manipulación).
•	Barniz selectivo para resaltar logo/título.
•	Detalles premium (según diseño): stamping, relieve, etc., cuando el diploma es parte de una entrega de alto valor.
",,,,,,,"Preguntas frecuentes
[{""question"":""¿Se pueden personalizar todos con nombres diferentes?”
“answer”:”Sí. Podemos imprimir diplomas con datos variables (nombres, cargos, categorías, numeración…), ideal para formaciones y eventos con muchos asistentes.""}
{""question"":""¿Cuál es el formato más recomendado?”
“answer”:”Normalmente A4 por practicidad. Si buscas un efecto más ceremonial o más visible en fotos, A3 suele funcionar muy bien.""}
{""question"":""¿Qué papel queda más “premium”?”
“answer”:”Los papeles con más gramaje y/o textura suelen dar mejor calidad percibida. La elección depende del estilo (corporativo sobrio vs. evento más festivo).""}
{""question"":""¿Podéis incluir sello o firma?”
“answer”:”Podemos imprimirlos integrados en el diseño. Si necesitas sello manual o firma real, también podemos recomendarte la opción más cómoda para la entrega.""}]
",,"https://webcms.blob.core.windows.net/media/product/eventos/diplomas.webp","1.200","1.200","alt descripció de la foto","[]","$0,00","0","EUR","Verdadero","0","Diplomas Personalizados para Eventos | Impresión Profesional en Barcelona","[{""label"":""Tamaño"",""name"":""tamaño"",""type"":""select"",""required"":true,""options"":[""Din A4"",""Din A3""]},{""label"":""Impresión"",""name"":""impresión"",""type"":""select"",""required"":true,""options"":[""1 cara"",""2 caras""]},{""label"":""Tintas"",""name"":""tintas"",""type"":""select"",""required"":true,""options"":[""Cuatricromía""]},{""label"":""Papel"",""name"":""papel"",""type"":""select"",""required"":true,""options"":[""Estucado mate 300 gr"",""Cartulina extra 300 gr"",""Conqueror 300 gr.""]},{""label"":""Cantidad"",""name"":""cantidad"",""type"":""number"",""required"":true},{""label"":""Observaciones"",""name"":""observaciones"",""type"":""text"",""required"":false}]",,"Imprime diplomas personalizados para cursos, entregas y eventos corporativos. Papel de calidad, acabados premium y datos variables. Presupuesto rápido con Repro Disseny.","https://reprodisseny.com/productos/diplomas","[{""lang"":""es-ES"",""url"":""https://reprodisseny.com/productos/diplomas""},{""lang"":""ca-ES"",""url"":""https://reprodisseny.com/productos/diplomas""}]","[""diplomas""]","{}","[""diplomas""]","[]",,,"[]",,,,,,"False"
"Díptico tarjeta de habitación para hoteles","diptico-tarjeta-habitacion-hotel","Verdadero",,"hosteleria-restauracion","01-HORE-0001","Reprodisseny",,"El díptico tarjeta de habitación es un básico en hostelería: acompaña al huésped desde el check-in y concentra la información que más se consulta durante la estancia (WiFi, horarios, servicios, contacto). En Repro Disseny imprimimos tarjetas de habitación plegadas con un acabado cuidado y opciones de resistencia para que se vean profesionales y aguanten el uso diario.","##Detalles 

¿Qué es un díptico tarjeta de habitación y para qué se usa? 

Es una tarjeta plegada (en formato díptico) que se deja en la habitación o se entrega en recepción con información práctica del alojamiento. Suele incluir datos de WiFi, horarios (desayuno, recepción, check-out), servicios (room service, spa, parking), normas básicas, contacto y, si se desea, QR a carta digital, reservas o guía del hotel. 

##Beneficios 

Mejora la experiencia del huésped: todo lo importante en una pieza clara y fácil de consultar. 

Reduce preguntas repetidas en recepción: WiFi, horarios, teléfonos y procedimientos quedan “a mano”. 

Refuerza la imagen de marca: diseño alineado con el estilo del hotel (corporativo, boutique, vacacional…). 

Información siempre actualizada: permite renovar por temporadas, cambios de servicios o campañas internas. 

Impulsa servicios adicionales: con QR o llamadas a la acción (spa, late check-out, restaurante, excursiones). 

##Aplicaciones 

Hoteles, hostales y apartamentos turísticos: información básica de estancia y contacto. 

Cadenas y franquicias: piezas homogéneas por centro, con variantes por idioma. 

Resorts y alojamientos con múltiples servicios: guía rápida de horarios, ubicaciones y reservas. 

Alojamientos con enfoque digital: QR a welcome page, guía de habitación, incidencias o check-out. 

##Características técnicas 

Formatos habituales 

Díptico en tamaños tipo DL, A6 o A5 (según cantidad de información). 

Orientación vertical u horizontal según el diseño y el soporte en habitación. 

Papel y resistencia 

Cartulinas de buen gramaje para una sensación más “premium” y mayor durabilidad. 

Opción de plastificado/laminado (mate o brillo) si va a manipularse mucho o quieres facilitar limpieza. 

Recomendación práctica: el mate suele funcionar muy bien en interior (menos reflejos y lectura más cómoda). 

Impresión 

A todo color para mantener identidad visual y fotografías/íconos. 

A una o dos caras (en díptico suele aprovecharse todo el espacio disponible). 

Plegado 

Hendido profesional para un plegado limpio (evita marcas y mejora la durabilidad). 

Idiomas y versiones 

Posibilidad de producir versiones por idioma o por tipo de habitación/edificio. 

Series por temporada (verano/invierno) o por campañas (packs, upgrades, eventos). 

Extras útiles 

QR a carta digital, reservas, guía del hotel, WhatsApp de atención, encuestas o reseñas. 

Espacio para datos variables si necesitas añadir información específica (p. ej., códigos internos o referencias). ",,,,,,,"Preguntas frecuentes 

[{""question"":""¿Qué tamaño es el más recomendado?” 
“answer”:”Depende de la cantidad de información. Si es “lo esencial”, un formato tipo DL/A6 funciona muy bien; si incluyes más servicios o mapa, A5 suele ser más cómodo.""}, 

{""question"":""¿Conviene plastificar?” 
“answer”:”Si se va a manipular mucho o quieres que dure más y se limpie mejor, sí. Para un look más elegante, mate suele ser la opción más equilibrada.""}, 

{""question"":""¿Podéis hacerlo en varios idiomas?” 
“answer”:”Sí, podemos preparar versiones por idioma manteniendo el mismo diseño base para coherencia de marca.""}, 

{""question"":""¿Podéis incluir QR a una página de bienvenida?” 
“answer”:”Sí, y te ayudamos a colocarlo con tamaño y contraste adecuados para que se escanee a la primera.""}]",,"https://webcms.blob.core.windows.net/media/product/restauracion/diptico-tarjeta%20habitacion.webp","1.200","1.200","alt descripció de la foto","[]","$0,00","0","EUR","Verdadero","0","Díptico Tarjeta de Habitación | Hoteles y Apartamentos | Impresión Profesional","[{""label"":""Tamaño"",""name"":""tamaño"",""type"":""select"",""required"":true,""options"":[""7"",""5x12 cm""]},{""label"":""Impresión"",""name"":""impresión"",""type"":""select"",""required"":true,""options"":[""2 caras""]},{""label"":""Tintas"",""name"":""tintas"",""type"":""select"",""required"":true,""options"":[""Cuatricromía""]},{""label"":""Papel"",""name"":""papel"",""type"":""select"",""required"":true,""options"":[""Cartulina gráfica de 240 gr.""]},{""label"":""Troquelado"",""name"":""troquelado"",""type"":""select"",""required"":true,""options"":[""Corte + ranuras""]},{""label"":""Cantidad"",""name"":""cantidad"",""type"":""number"",""required"":true},{""label"":""Observaciones"",""name"":""observaciones"",""type"":""text"",""required"":false}]",,"Díptico tarjeta de habitación para hoteles: info WiFi, horarios y servicios con diseño corporativo. Papel resistente, plastificado opcional y QR. Solicita presupuesto.","https://reprodisseny.com/productos/diptico-habitacion","[{""lang"":""es-ES"",""url"":""https://reprodisseny.com/productos/diptico-habitacion""},{""lang"":""ca-ES"",""url"":""https://reprodisseny.com/productos/diptico-habitacion""}]","[""díptico tarjeta habitación""]","{}","[""díptico tarjeta habitación""]","[]",,,"[]",,,,,,"False"
"Panel Dispa","panel-dispa-personalizado","Verdadero",,"material-rigido","01-GRFO-0014","Reprodisseny",,"El panel Dispa es una opción muy utilizada en campañas y comunicación interior cuando buscas un soporte rígido, muy ligero y con un enfoque más sostenible. Está fabricado en 100% papel, por lo que es reciclable, y ofrece una superficie blanca de buena calidad para impresión en cartelería, señalética y PLV.","##Detalles 

¿Qué es un panel Dispa y para qué se usa? 

El panel Dispa es un panel rígido de papel con una estructura interna en relieve/embosada que le da rigidez y estabilidad manteniendo un peso muy bajo. Está pensado para impresión digital y serigrafía y se usa sobre todo en interior para campañas rápidas, cartelería colgante, expositores y comunicación en punto de venta. 

##Beneficios 

Ligero y fácil de manipular: ideal para colgar, montar y mover en campañas y eventos. 

Soporte más sostenible: composición 100% papel y reciclable, con opciones certificadas FSC según proveedor. 

Buena planitud y rigidez: la estructura interna ayuda a que el panel se mantenga estable y con buena presencia.  

Superficie adecuada para impresión: acabado blanco que funciona bien para gráficos, textos y fotografía.  

Corte y troquelado a medida: perfecto para siluetas, flechas, displays y formas creativas.  

##Aplicaciones 

PLV y expositores en punto de venta (promos, lanzamientos, corners).  

Cartelería colgante y aérea (campañas temporales).  

Señalética interior (direccionales, zonas, información).  

Ferias y eventos: paneles informativos, traseras, comunicación rápida. ( 

Fotomontaje / montaje de láminas y pósters.  

##Características técnicas 

Composición 

Panel de 100% papel con capas exteriores blancas y núcleo de papel con estructura embosada para aportar rigidez.  

Impresión 

Apto para impresión digital (UV/latex según equipo) y serigrafía.  

Medidas y grosores 

Formatos estándar o a medida, con grosores habituales de este tipo de panel según necesidad del proyecto (cartelería, colgante, display, etc.).  

Corte y acabados 

Corte recto o corte a medida/troquelado (formas, siluetas, piezas de PLV).  

Posibilidad de preparar taladros/ranuras si se necesita para colgar o montar. 

Uso recomendado 

Especialmente indicado para interior y campañas temporales. Existen versiones orientadas a exterior según proveedor, pero conviene definir ubicación y duración para escoger el soporte adecuado. (Antalis) 

Sostenibilidad 

Al ser un soporte 100% papel, es reciclable; si necesitas mantenerlo “lo más reciclable posible”, te aconsejamos evitar acabados no compatibles con el reciclaje según el uso.",,,,,,,"Preguntas frecuentes 

[{""question"":""¿Es un producto reciclable?” 
“answer”:”Sí. El panel Dispa es 100% papel y se comercializa como reciclable.""}, 

{""question"":""¿Dispa o foam (cartón pluma)?” 
“answer”:”Si buscas una opción más sostenible basada en papel y muy ligera para campañas, Dispa encaja muy bien; para otras necesidades (más resistencia o exterior), valoramos alternativas según el caso.""}, 

{""question"":""¿Se puede hacer con forma personalizada?” 
“answer”:”Sí, admite corte y troquelado para siluetas y piezas de PLV.""}]",,"https://webcms.blob.core.windows.net/media/product/gran-formato/material-rigido/dispa.webp","1.200","1.200","alt descripció de la foto","[]","$0,00","0","EUR","Verdadero","0","Panel Dispa personalizado | Cartón rígido ligero y reciclable","[{""label"":""Tamaño"",""name"":""tamaño"",""type"":""select"",""required"":true,""options"":[""Personalizado a demanda""]},{""label"":""Impresión"",""name"":""impresión"",""type"":""select"",""required"":true,""options"":[""Cuatricromía 1 cara"",""Cuatricromía 2 caras""]},{""label"":""Material"",""name"":""material"",""type"":""select"",""required"":true,""options"":[""Dispa 3"",""8 mm""]},{""label"":""Color"",""name"":""color"",""type"":""select"",""required"":true,""options"":[""Blanco""]},{""label"":""Corte"",""name"":""corte"",""type"":""select"",""required"":true,""options"":[""Recto"",""A la forma""]},{""label"":""Cantidad"",""name"":""cantidad"",""type"":""number"",""required"":true},{""label"":""Observaciones"",""name"":""observaciones"",""type"":""text"",""required"":false}]",,"Panel Dispa impreso a medida: rígido, muy ligero, 100% papel y reciclable. Ideal para cartelería, señalética y PLV en interior. Corte recto o a la forma. Solicita presupuesto.","https://reprodisseny.com/productos/dispa","[{""lang"":""es-ES"",""url"":""https://reprodisseny.com/productos/dispa""},{""lang"":""ca-ES"",""url"":""https://reprodisseny.com/productos/dispa""}]","[""dispa""]","{}","[""dispa""]","[]",,,"[]",,,,,,"False"
