"Title","Slug","IsPublished","SortOrder","PrimaryCategory","Sku","Brand","Categories","ShortDescription","BodyMd","DetailsMd","BenefitsMd","MaterialsMd","FinishesMd","TechnicalSpecsMd","ApplicationsMd","FaqsJson","PublishedAt","ImageSrc","ImageWidth","ImageHeight","ImageAlt","GalleryImagesJson","Price","ReviewCount","PriceCurrency","InStock","RatingValue","MetaTitle","FormFieldsJson","FormatsMd","MetaDescription","Canonical","HrefLangJson","KeywordsJson","SchemaJson","SearchTermsJson","AttributesJson","Gtin13","Mpn","VariantsJson","LegacySlugsJson","RobotsOverride","RobotsAdvanced","OgImageSrc","Path","NoIndex"
"Identificador de maleta","idenficador-maleta","Verdadero",,"eventos","01-EVEN-0016","Reprodisseny",,"El identificador de maleta es un detalle práctico que evita pérdidas y, a la vez, refuerza tu marca en viajes de empresa, eventos y grupos. En Repro Disseny fabricamos tags de equipaje personalizados con materiales resistentes, troquel a medida y opciones de laminado para que aguanten manipulación y transporte.","##Detalles
¿Qué es un identificador de maleta y para qué se usa?
Un identificador de maleta es una tarjeta (o pieza rígida) que se fija al equipaje para mostrar datos básicos de identificación: nombre, empresa/grupo, teléfono o referencia. Se utiliza en viajes corporativos, congresos, eventos deportivos, excursiones y desplazamientos en grupo para reconocer maletas rápidamente y minimizar confusiones o extravíos.
##Beneficios
•	Identificación inmediata del equipaje: reduce pérdidas y confusiones en grupos.
•	Más orden en logística: útil para eventos con traslados, check-in de hotel o autocares.
•	Branding visible: tu marca viaja con el grupo (ideal para empresas y organizadores).
•	Personalización por persona: nombres, departamentos, equipos, numeración o colores por categoría.
•	Resistencia: materiales y acabados pensados para roce, golpes y manipulación.
##Aplicaciones
•	Viajes corporativos: convenciones, incentivos, roadshows y desplazamientos de equipo.
•	Congresos y ferias: grupos, expositores y staff con logística de equipaje.
•	Eventos deportivos: clubs, torneos, competiciones y viajes de equipo.
•	Agencias y grupos turísticos: excursiones, viajes organizados, grupos escolares.
•	Hoteles: grupos y MICE (identificación rápida en entradas/lobby).
##Características técnicas
Formato y troquel
•	Formatos estándar o a medida (rectangular, redondo, con forma).
•	Troquel con ranura/orificio preparado para sujeción con cinta, brida o cordón.
•	Posibilidad de incluir zona para escribir datos si se requiere (según diseño).
Material
•	Cartulinas de alto gramaje para una opción económica y práctica.
•	Materiales más resistentes (según necesidad) para mayor durabilidad en viajes y manipulación intensiva.
Impresión
•	Impresión a todo color para branding, códigos por equipo o diseño corporativo.
•	Una o dos caras: por ejemplo, marca por un lado y datos/QR por el otro.
Personalización y control
•	Datos variables: nombre, empresa, número de participante, equipo, departamento, etc.
•	Numeración por series para logística de grupo.
•	QR opcional: información del grupo, contacto, incidencias o ficha de identificación.
Acabados recomendados
•	Laminado mate o brillo: mejora resistencia al roce y a la humedad superficial.
•	Esquinas redondeadas: aumentan durabilidad y evitan que se doblen/dañen en los cantos.
",,,,,,,"Preguntas frecuentes
[{""question"":""¿Se pueden personalizar con un nombre distinto en cada uno?”
“answer”:”Sí, con datos variables (nombre, equipo, número, etc.), ideal para grupos.""}
{""question"":""¿Qué acabado recomendáis para que duren más?”
“answer”:”Normalmente laminado + esquinas redondeadas, especialmente si habrá mucho viaje y manipulación.""}
{""question"":""¿Podéis hacer versiones por equipos o categorías?”
“answer”:”Sí, podemos crear variantes por color/diseño para diferenciar departamentos, equipos o grupos.""}
{""question"":""¿Qué necesitáis para presupuestar?”
“answer”:”Cantidad, tamaño aproximado, si irá con datos variables (listado) y el sistema de sujeción (cordón/brida/cinta) si lo tienes definido.""}]
",,"https://webcms.blob.core.windows.net/media/product/restauracion/identificador-maleta.webp","1.200","1.200","alt descripció de la foto","[]","$0,00","0","EUR","Verdadero","0","Identificador de maleta personalizado | Viajes, eventos y branding corporativo","[{""label"":""Tamaño"",""name"":""tamaño"",""type"":""select"",""required"":true},{""label"":""Impresión"",""name"":""impresión"",""type"":""select"",""required"":true,""options"":[""Cuatricromía 1 cara"",""Cuatricromía 2 caras""]},{""label"":""Papel"",""name"":""papel"",""type"":""select"",""required"":true},{""label"":""Cantidad"",""name"":""cantidad"",""type"":""number"",""required"":true},{""label"":""Observaciones"",""name"":""observaciones"",""type"":""text"",""required"":false}]",,"Identificadores de maleta personalizados para viajes, congresos y eventos. Resistentes, con troquel y opciones de laminado, datos variables y QR. Solicita presupuesto.","https://reprodisseny.com/productos/idenficador-maleta","[{""lang"":""es-ES"",""url"":""https://reprodisseny.com/productos/idenficador-maleta""},{""lang"":""ca-ES"",""url"":""https://reprodisseny.com/productos/idenficador-maleta""}]","[""identificador de maleta""]","{}","[""identificador de maleta""]","[]",,,"[]",,,,,,"False"
"Identificador de maleta personalizado","identificadores-de-maleta-personalizados","Verdadero",,"hosteleria-restauracion","01-HORE-0008","Reprodisseny",,"El identificador de maleta es un detalle práctico que evita pérdidas y, a la vez, refuerza tu marca en viajes de empresa, eventos y grupos. En Repro Disseny fabricamos tags de equipaje personalizados con materiales resistentes, troquel a medida y opciones de laminado para que aguanten manipulación y transporte.","##Detalles 

¿Qué es un identificador de maleta y para qué se usa? 

Un identificador de maleta es una tarjeta (o pieza rígida) que se fija al equipaje para mostrar datos básicos de identificación: nombre, empresa/grupo, teléfono o referencia. Se utiliza en viajes corporativos, congresos, eventos deportivos, excursiones y desplazamientos en grupo para reconocer maletas rápidamente y minimizar confusiones o extravíos. 

##Beneficios 

Identificación inmediata del equipaje: reduce pérdidas y confusiones en grupos. 

Más orden en logística: útil para eventos con traslados, check-in de hotel o autocares. 

Branding visible: tu marca viaja con el grupo (ideal para empresas y organizadores). 

Personalización por persona: nombres, departamentos, equipos, numeración o colores por categoría. 

Resistencia: materiales y acabados pensados para roce, golpes y manipulación. 

##Aplicaciones 

Viajes corporativos: convenciones, incentivos, roadshows y desplazamientos de equipo. 

Congresos y ferias: grupos, expositores y staff con logística de equipaje. 

Eventos deportivos: clubs, torneos, competiciones y viajes de equipo. 

Agencias y grupos turísticos: excursiones, viajes organizados, grupos escolares. 

Hoteles: grupos y MICE (identificación rápida en entradas/lobby). 

##Características técnicas 

Formato y troquel 

Formatos estándar o a medida (rectangular, redondo, con forma). 

Troquel con ranura/orificio preparado para sujeción con cinta, brida o cordón. 

Posibilidad de incluir zona para escribir datos si se requiere (según diseño). 

Material 

Cartulinas de alto gramaje para una opción económica y práctica. 

Materiales más resistentes (según necesidad) para mayor durabilidad en viajes y manipulación intensiva. 

Impresión 

Impresión a todo color para branding, códigos por equipo o diseño corporativo. 

Una o dos caras: por ejemplo, marca por un lado y datos/QR por el otro. 

Personalización y control 

Datos variables: nombre, empresa, número de participante, equipo, departamento, etc. 

Numeración por series para logística de grupo. 

QR opcional: información del grupo, contacto, incidencias o ficha de identificación. 

Acabados recomendados 

Laminado mate o brillo: mejora resistencia al roce y a la humedad superficial. 

Esquinas redondeadas: aumentan durabilidad y evitan que se doblen/dañen en los cantos. ",,,,,,,"Preguntas frecuentes 

[{""question"":""¿Se pueden personalizar con un nombre distinto en cada uno?” 
“answer”:”Sí, con datos variables (nombre, equipo, número, etc.), ideal para grupos.""}, 

{""question"":""¿Qué acabado recomendáis para que duren más?” 
“answer”:”Normalmente laminado + esquinas redondeadas, especialmente si habrá mucho viaje y manipulación.""}, 

{""question"":""¿Podéis hacer versiones por equipos o categorías?” 
“answer”:”Sí, podemos crear variantes por color/diseño para diferenciar departamentos, equipos o grupos.""}, 

{""question"":""¿Qué necesitáis para presupuestar?” 
“answer”:”Cantidad, tamaño aproximado, si irá con datos variables (listado) y el sistema de sujeción (cordón/brida/cinta) si lo tienes definido.""}]",,"https://webcms.blob.core.windows.net/media/product/restauracion/identificador-maleta.webp","1.200","1.200","alt descripció de la foto","[]","$0,00","0","EUR","Verdadero","0","Identificador de maleta personalizado | Viajes, eventos y branding corporativo","[{""label"":""Tamaño"",""name"":""tamaño"",""type"":""select"",""required"":true,""options"":[""6"",""5x11"",""7 cm"",""6"",""5x14"",""7 cm""]},{""label"":""Impresión"",""name"":""impresión"",""type"":""select"",""required"":true,""options"":[""Cuatricromía 1 cara"",""Cuatricromía 2 caras""]},{""label"":""Material"",""name"":""material"",""type"":""select"",""required"":true,""options"":[""Polipropileno"",""Cartulina gráfica""]},{""label"":""Troquelado"",""name"":""troquelado"",""type"":""select"",""required"":true,""options"":[""A la forma""]},{""label"":""Cantidad"",""name"":""cantidad"",""type"":""number"",""required"":true},{""label"":""Observaciones"",""name"":""observaciones"",""type"":""text"",""required"":false}]",,"Identificadores de maleta personalizados para viajes, congresos y eventos. Resistentes, con troquel y opciones de laminado, datos variables y QR. Solicita presupuesto.","https://reprodisseny.com/productos/identificador-maleta","[{""lang"":""es-ES"",""url"":""https://reprodisseny.com/productos/identificador-maleta""},{""lang"":""ca-ES"",""url"":""https://reprodisseny.com/productos/identificador-maleta""}]","[""identificador de maleta""]","{}","[""identificador de maleta""]","[]",,,"[]",,,,,,"Verdadero"
"Imanes publicitarios","imanes-publicitarios","Verdadero",,"material-publicitario","01-OFICI-0012","Reprodisseny",,"Los imanes personalizados son un soporte publicitario muy efectivo porque se quedan en un sitio visible durante mucho tiempo: neveras, archivadores metálicos, taquillas o paneles. En Repro Disseny producimos imanes a medida con impresión a color y corte a la forma, ideales para campañas, recordatorios, fidelización o branding en punto de venta.","##Detalles 

¿Qué es un imán personalizado y para qué se usa? 

Un imán personalizado es una pieza impresa con base magnética que se adhiere a superficies metálicas sin adhesivos. Se utiliza como soporte de marca y recordatorio (teléfono, web, servicios), como elemento promocional (calendarios, cupones, campañas) o como material funcional para organización interna (etiquetas magnéticas, señalización temporal). 

##Beneficios 

Alta permanencia: no se tira fácilmente; se mantiene visible semanas o meses. 

Publicidad útil: funciona como recordatorio práctico (teléfono, cita, horario, QR). 

Fácil de repartir: ligero y económico para campañas masivas. 

Sin pegamentos: se pone y se quita sin dejar residuo en superficies metálicas. 

Personalización total: tamaños, formas, mensajes por campaña o por zona. 

##Aplicaciones 

Imanes de nevera: talleres, clínicas, seguros, restauración (teléfono a mano). 

Promociones y fidelización: campañas con QR, códigos, descuentos o sorteos. 

Calendarios magnéticos: marca presente todo el año en casa u oficina. 

Organización interna: etiquetas magnéticas para almacén, paneles o planificación. 

Señalización temporal en retail: mensajes que cambian sin adhesivos (en mobiliario metálico). 

##Características técnicas 

Formatos y corte 

Formatos estándar (rectangular/cuadrado/redondo) o corte a medida con la forma que necesites (logo, icono, silueta de producto). 

Posibilidad de series con distintas formas/tamaños en una misma campaña. 

Impresión 

Impresión a color con buena definición para logos, tipografías e imágenes. 

Recomendación práctica: mensajes cortos y claros (un imán se consulta “de un vistazo”). 

Grosor y uso 

Diferentes opciones de grosor según tamaño, rigidez y uso (promocional vs. más funcional). 

Elección en función de dónde se colocará y cuánto quieres que dure. 

Acabados 

Acabado mate (menos reflejos) o brillo (más vivo) según el estilo. 

Protección extra si el imán va a manipularse mucho (por ejemplo, uso diario). 

Personalización por campañas 

Variantes por zona, idioma, franquicia o promoción (misma base de diseño con cambios de datos). 

Integración de QR para reservas, contacto, catálogo, reseñas o landing de campaña. ",,,,,,,"Preguntas frecuentes
[{""question"":""¿En qué superficies funciona un imán?”
“answer”:”En superficies metálicas (nevera, armarios, paneles de acero, etc.). No funciona en aluminio, cristal o madera (salvo que haya base metálica).""},
{""question"":""¿Se puede hacer con forma personalizada?”
“answer”:”Sí, con corte a medida para logos, iconos o siluetas.""},
{""question"":""¿Qué tamaño es el más recomendable?”
“answer”:”Depende del uso: para nevera, tamaños compactos con teléfono/QR funcionan muy bien; para organización o señalización, puede interesar algo más grande.""},
{""question"":""¿Se pueden hacer varios modelos en la misma tirada?”
“answer”:”Sí, podemos preparar versiones por campaña (diseños distintos, códigos, mensajes, sedes).""}]
",,"https://webcms.blob.core.windows.net/media/product/publicidad-oficina/publicidad/imanes-publicitarios.webp","1.200","1.200","alt descripció de la foto","[]","$0,00","0","EUR","Verdadero","0","Imanes personalizados | Publicidad práctica para empresas y campañas","[{""label"":""Tamaño"",""name"":""tamaño"",""type"":""select"",""required"":true,""options"":[""Personalizado a demanda""]},{""label"":""Impresión"",""name"":""impresión"",""type"":""select"",""required"":true,""options"":[""Cuatricromía 1 cara""]},{""label"":""Material"",""name"":""material"",""type"":""select"",""required"":true,""options"":[""Estucado 200 gr + Imán 1 mm""]},{""label"":""Acabados"",""name"":""acabados"",""type"":""select"",""required"":true,""options"":[""Plastificado brillo"",""Plastificado mate"",""Plastificado velleda""]},{""label"":""Corte"",""name"":""corte"",""type"":""select"",""required"":true,""options"":[""Recto"",""A la forma""]},{""label"":""Cantidad"",""name"":""cantidad"",""type"":""number"",""required"":true},{""label"":""Observaciones"",""name"":""observaciones"",""type"":""text"",""required"":false},{""label"":""Forma"",""name"":""forma"",""type"":""select"",""required"":true,""options"":[""De nevera"",""Pizarras magnéticas"",""Para coches"",""Calendarios""]},{""label"":""Impresión"",""name"":""impresión"",""type"":""select"",""required"":true,""options"":[""Cuatricromía 1 cara""]},{""label"":""Papel"",""name"":""papel"",""type"":""select"",""required"":true,""options"":[""Cartulina de 200 gr. + Plastificado brillo""]},{""label"":""Material"",""name"":""material"",""type"":""select"",""required"":true,""options"":[""Imán 1mm""]},{""label"":""Troquelado"",""name"":""troquelado"",""type"":""select"",""required"":true,""options"":[""A la forma""]},{""label"":""Cantidad"",""name"":""cantidad"",""type"":""number"",""required"":true},{""label"":""Observaciones"",""name"":""observaciones"",""type"":""text"",""required"":false}]",,"Imanes personalizados para publicidad y organización: imanes de nevera, imanes con forma, calendarios e imanes para vehículos. Impresión a color y corte a medida. Solicita presupuesto.","https://reprodisseny.com/productos/imanes","[{""lang"":""es-ES"",""url"":""https://reprodisseny.com/productos/imanes""},{""lang"":""ca-ES"",""url"":""https://reprodisseny.com/productos/imanes""}]","[""imanes""]","{}","[""imanes""]","[]",,,"[]",,,,,,"Verdadero"
"Lanyards personalizados para eventos","lanyards-eventos-barcelona","Verdadero",,"eventos","01-EVEN-0004","Reprodisseny",,"Los lanyards son un básico en cualquier evento: facilitan la identificación, ordenan accesos y refuerzan la imagen de marca en ferias, congresos y actos corporativos. Personalizamos lanyards para staff, ponentes, expositores o asistentes, con opciones de impresión a color y accesorios según el uso.","##Detalles
¿Qué es un lanyard y para qué se usa?
Un lanyard es una cinta (normalmente para llevar al cuello) que permite colgar una acreditación, tarjeta, llave o identificador. En eventos funciona como elemento de identificación visible, ayuda a diferenciar roles (VIP, prensa, staff…) y aporta coherencia con el resto del material gráfico del evento.
##Beneficios
•	Identificación inmediata: hace más fácil reconocer asistentes, organización y perfiles especiales.
•	Mejor control de accesos: combinado con acreditaciones y QR, agiliza check-in y zonas restringidas.
•	Marca presente todo el tiempo: tu logo y colores visibles durante todo el evento (y en fotos).
•	Comodidad y seguridad: opciones de cierre/seguridad y accesorios para que sea práctico durante horas.
•	Personalización por roles: distintos colores o diseños para staff, ponentes, expositores, etc.
##Aplicaciones
•	Ferias y congresos: acreditaciones para asistentes, expositores y ponentes.
•	Eventos corporativos: convenciones internas, formaciones, presentaciones de marca.
•	Eventos culturales/deportivos: organización, prensa, backstage, staff técnico.
•	Acciones de marca y activaciones: promotores, equipos itinerantes, acceso a zonas.
##Características técnicas
Anchos y formato
•	Anchos habituales: 10 / 15 / 20 / 25 mm (según visibilidad del logo y comodidad).
•	Longitud estándar para cuello o configuración a medida si necesitas un formato específico.
Materiales (según objetivo)
•	Lanyard estándar para uso general en eventos.
•	Opciones con acabado más “premium” (más suave/brillante) cuando el evento requiere una imagen más cuidada.
•	Opciones más resistentes si habrá mucho uso o varios días.
Impresión y personalización
•	Impresión a color con logo, patrocinadores, claim o web.
•	Posibilidad de doble cara si necesitas más información o máxima visibilidad.
•	Variantes por rol (p. ej., distintos colores/diseños para staff, VIP, ponentes…).
Accesorios y configuraciones
•	Mosquetón/gancho para colgar porta-acreditación o tarjeta.
•	Cierre de seguridad (breakaway) recomendado cuando prima la seguridad.
•	Buckle o hebilla desmontable si se va a usar con frecuencia (muy práctico para quitar la acreditación sin quitarse el lanyard).
•	Porta-acreditaciones (fundas) según el tamaño de la tarjeta.
Acabados y extras
•	Opción de acabados pensados para aguantar manipulación (si se va a usar muchas horas/días).
•	Empaquetado por sets si vas a entregar packs (lanyard + acreditación).
",,,,,,,"Preguntas frecuentes
[{""question"":""¿Se pueden hacer lanyards distintos para staff, ponentes y asistentes?”
“answer”:”Sí. Es muy habitual preparar variantes por rol (color/diseño) para que la identificación sea inmediata.""}
{""question"":""¿Qué ancho recomendáis?”
“answer”:”Para la mayoría de eventos, 15 o 20 mm suele ser el equilibrio ideal entre comodidad y visibilidad del logo.""}
{""question"":""¿Podéis entregarlos con acreditación incluida?”
“answer”:”Sí. Podemos preparar el pack completo: lanyard + acreditación (y, si hace falta, funda/clip), para que llegue listo para repartir.""}
{""question"":""¿Hay opciones más seguras o más cómodas?”
“answer”:”Sí: cierre de seguridad y hebilla desmontable, según el tipo de evento y el público.""}]
",,"https://webcms.blob.core.windows.net/media/product/eventos/lanyard.webp","1.200","1.200","alt descripció de la foto","[]","$0,00","0","EUR","Verdadero","0","Lanyards Personalizados para Eventos | Impresión y Personalización","[{""label"":""Tipo de impresion"",""name"":""impresión"",""type"":""select"",""required"":true,""options"":[""Sublimación"",""Serigrafía""]},{""label"":""Tintas"",""name"":""tintas"",""type"":""select"",""required"":true,""options"":[""1"",""2"",""Cuatricromía""]},{""label"":""Ancho cinta"",""name"":""ancho"",""type"":""select"",""required"":true,""options"":[""10 mm"",""15 mm"",""20 mm"",""25 mm""]},{""label"":""Cantidad"",""name"":""cantidad"",""type"":""number"",""required"":true},{""label"":""Observaciones"",""name"":""observaciones"",""type"":""text"",""required"":false}]",,"Lanyards personalizados para ferias, congresos y eventos corporativos. Con impresión a color, diferentes anchos y accesorios. Pide presupuesto a Repro Disseny.","https://reprodisseny.com/productos/lanyards","[{""lang"":""es-ES"",""url"":""https://reprodisseny.com/productos/lanyards""},{""lang"":""ca-ES"",""url"":""https://reprodisseny.com/productos/lanyards""}]","[""lanyards""]","{}","[""lanyards""]","[]",,,"[]",,,,,,"Verdadero"
